<?xml version="1.0" encoding="UTF-8"?>
<script xmlns="http://mobilis.inf.tu-dresden.de/XMLEmulationScript" xmlns:xsi="http://www.w3.org/2001/XMLSchema-instance" xsi:schemaLocation="http://mobilis.inf.tu-dresden.de/XMLEmulationScript XMLEmulationScript.xsd">
   <setupCommand>
       <instanceVarDeclaration varName="PALatency1" appNS="de.tudresden.inf.rn.mobsda.performance.latency" instanceId="1"/>
   </setupCommand>
   <setupCommand>
       <instance>PALatency1</instance>
       <start/>
   </setupCommand>
   <testCommand>
       <instance>PALatency1</instance>
       <methodName>initMeasurements</methodName>
       <parameter>
           <string>measurer1@mobsda.inf.tu-dresden.de</string>
           <string>measurer1</string>
           <string>mobsda:powerassistant:fuellevel</string>
       </parameter>
   </testCommand>
</script>
